,audit_observation,recommendations,status_of_implementation,reasons_for_partial_or_non_implementation,management_action,references
1949,,"receivables and special education tax receivables for cy 2012, both in the amount of p4,049,393.30, were not based on real property tax account register/taxpayer’s index card but on the total assessed value of property as reported by the municipal assessor due to the failure of the treasury office to furnish the accounting office of a duly certified list of taxpayers and the amount due and collectible for the year, contrary to section 20, volume i of the new government accounting system thus rendering the recorded receivable inaccurate. we recommended that management instruct the treasury office to prepare and furnish the accounting office the list required by section 20 of the ngas volume i to be able to come up with an accurate amount of receivables for the year.",,,implementeded,aar
1951,,"10. due to inadequate planning, development funds amounting to p4,623,642.84 or 28.14 percent of the total development fund remained unutilized as of year-end, contrary to the mandate of an effective and efficient delivery of services and facilities to the constituents, amounting to a denial of improved health, social, economic and infrastructure services to the constituents. we recommended that management instruct concerned offices to prepare the development plan of the municipality properly that would include beneficial projects for its constituents. the planned projects should be supported with a detailed program of work.",,,partially implemented,2012 aar
1953,,"12. the municipality failed to formulate and issue its guidelines for the implementation of the national greening program, in violation of section 6 of executive order 26 dated 24 february 2011, thus, the program’s objectives of poverty reduction, resource conservation and protection, productivity enhancement and climate change mitigation and adaptation may not be achieved within the prescribed period of six years, from 2011 to 2016. we recommended that the municipality prepare its guidelines for the implementation of the ngp to ensure the attainment of its goals.",,,partially implemented,2012 aar
2135,," require the property officer to complete the physical count of the lgu’s ppe that was started by the previous property officer in 2010, thereupon, start the required reconciliation of the results of the inventory count with the property records maintained by the accounting department to arrive at the correct balance of ppe accounts in the financial statements;  create an inventory committee, consisting of a representative from the office of the municipal mayor, treasurer’s office and accounting office, including the property officer, to hasten the inventory taking; and,  perform periodic inventory of ppe and prepare report on the results thereof, in accordance with existing regulations.",,"no explanation from the manageme nt and reply to our manageme nt letter dated oct. 15, 2012",,"part ii, observati on no. 1, page 21 to 22, cy 2012 arr"
2137,," the municipal engineer should be required to submit the above mentioned documents together with the attachment and strictly comply with coa circulars no. 96-010, 2005-27 and 2009-001. furthermore, it is required that the project documents and status report as of december 31, 2012 be accomplished and submitted to auditor’s office for review, evaluation and inspection. the office of the municipal mayor should be requested to submit the copy of contracts, memorandum of agreements, purchase orders and its supporting papers to the audit team on the prescribed period, including resolutions and ordinances related thereto.",,,,"part ii, observati on no.3, page 24 to 26, cy 2012 aar"
2138,," the municipal treasurer should be required to submit the above mentioned documents together with the attachment to the sanggunian bayan and strictly comply with section 269 of irr of ra 7160, for uncollected delinquent real property taxes.",,"no explanation from the manageme nt and reply to our manageme nt letter dated oct. 15, 2012",,"part ii, observati on no. 4, page 27 to 30, cy 2012 aar"
2139,, we recommended that each department/offices prepare and submit its individual project procurement management plan within the time prescribed by law in order for the bac secretariat to have enough time for the consolidation of app and the approval by the local chief executive as required under section 7.4 of the irr of ra 9184.,,,,"part ii, observati on no. 5, page 30 to 31,cy 2012 aar"
2140,," we recommended that the ldrrmo, municipal treasurer and accountant must comply with the implementing rules and regulations of r. a. no. 10121 and coa circular 2012-002 dated september 12, 2012 particularly in the transfer of unexpended/unobligated balance of the qrf and the drrmf- mooe to the special trust fund and the preparation and submission of the monthly report on sources and utilization of disaster risk reduction and management fund.",,,,"part ii, observati on no.6,pag e 31 to 32, cy 2012 aar"
2142,, the audit team recommended to the chief executive for the institutionalization of gad in the municipality and the integration thereof to its overall annual plans and programs. proper gad implementation shall likewise be observed in compliance with the provisions of dbm-neda- ncrfw joint circular no. 2004- 1.,,,,"part ii, observati on no.8, page 34 to 37, cy 2012 aar"
2212,,2. the grant and liquidation of cash advances were not in accordance with the,,implemented,the cash advances granted to officers and employees were fully,aar 2012 observ
2213,,"provisions of coa circular no. 97-002, thereby resulting in the accumulation of cash advances at year-end totaling p289,119.71. we recommended that the municipal mayor should require the immediate liquidation of cash advances by the concerned employees. moreover, the municipal accountant should not process cash advances of those with unliquidated cash advances pursuant to the provisions of coa circular no. 97- 002. furthermore, we reiterated our demand for the liquidation of cash advances embodied in coa circular no. 2012-004 dated november 28, 2012. failure to do so on or before january 31, 2013 shall constitute cause for the filing of malversation charge under article 217, failure to liquidate cash advance under article 218 both of the revised penal code or criminal prosecution under section 128 of p.d. no. 1445.",,,liquidated at year-end,"ation no.2, page 22-24"
2214,,"3. cash in bank balances of the three (3) funds as of december 31, 2012 amounting to p8,237,652.24 are not reliable due to non- preparation or delayed preparation of monthly bank reconciliation statements contrary to the provisions of section 74 of presidential decree no. 1445 and section 3.2 of coa circular no. 96-011. we recommended that the municipal accountant should regularly prepare the monthly bank reconciliation statements in compliance with p.d. no. 1445 and coa circulars 96-11. in doing so, appropriate adjustments shall be made to reconcile the bank and ledger balances and so with the cashbook balance of the municipal treasurer.",,implemented,monthly bank reconciliation statements were prepared by the accounting section.,"aar 2012 observ ation no.3, pages 24-25"
2219,,"8. the accounts of the lgu for the cy 2012 were only submitted to the commission on audit on march 6 and 7, 2013 which is not in accordance with",,not implemented,management failed to submit their accounts on time.,"aar 2012 observ ation no.8, pages"
2220,,"existing laws, rules and regulations, hence the municipal accountant may be held liable administratively or criminally for non- compliance. we recommended that the municipal accountant should cause the immediate submission of the accounts of the lgu in compliance with existing laws, rules and regulations.",,,,30-31
2221,,"9. procurement of goods and services for infrastructure projects in the total amount of p18,570,491.25 were made on a reimbursement basis which is not in accord with section 93 of presidential decree no. 1445 and section 3, rule i of the revised implementing rules and regulations of republic act no. 9184, casting doubt as to whether said transactions are the most advantageous to the lgu and also depriving the bureau of internal revenue of the taxes due thereon. moreover, disbursement vouchers covering payment of said reimbursements were not supported with complete documents contrary to section 4(6) of presidential decree no. 1445, thus, the validity and legality of the transactions cannot be ascertained. to forestall the occurrence of similar transactions, we recommended that management should strictly comply with the provisions of the revised implementing rules of r.a. no. 9184 in the procurement of goods and services. moreover, the practice of disbursements through reimbursement should be refrained by paying the amount due directly to the creditor.",,not implemented reiterated in finding no. 12 of the report.,reimbursement method is still adopted in the procurement of goods and services.,"aar 2012 observ ation no.9, pages 32-34"
2222,,"furthermore, disbursement vouchers covering payment of transactions should be duly supported with complete documents. 10. some of the programs and projects charged to the 20% internal revenue allotment for development projects are not among those intended projects covered by the fund which is not in accord with dilg-dbm joint memorandum circular no. 2011-1, resulting in the irregular disbursement of municipal funds. we recommended that the municipal budget officer should ensure that the programs and projects to be included in the priority development projects funded by the 20% development fund of the lgu should be consistent with the priority programs and projects contained in dilg-dbm joint memorandum circular no. 2011-1 to avoid the unauthorized use of municipal funds.",,not implemented reiterated in finding no. 14 of the report.,there are still programs and projects charged by management under the 20% df which should have not been covered by said fund.,"aar 2012 observ ation no.10, pages 34-35"
2226,,"14. the municipal treasurer and the municipal accountant failed to regularly reconcile the cashbook balances with the general ledger balances for cash accounts contrary to coa memorandum no., 84-373 and section 6.3 of coa circular no. 97-002, hence, errors committed will not be timely adjusted. we recommended that the municipal accountant and the municipal treasurer should reconcile regularly the cash balances of the general ledger and the cashbook in compliance with coa memorandum no., 84-373 and section 6.3 of coa circular no. 97-002.",,not implemented reiterated in finding no. 2 of the report.,no reconciliation has been made between the accounting and treasury office because the cashbooks of the municipal treasurer are not yet updated.,"aar 2012 observ ation no.14, pages 39"
2227,,"15. the accountability for accountable forms cannot be easily established due to the non-preparation by the office of the treasurer of a complete consolidated report of accountability for accountable forms (craaf) and the non- submission of the same on time together with the individual raaf of all collectors, contrary to section 51 of the manual on the new government accounting system for lgus, volume ii. we recommended that the municipal treasurer should require the collectors to prepare their report of accountability for accountable forms on a monthly basis and submit the same to him for the preparation of the monthly consolidated report of accountability for accountable forms. said reports should be submitted to the office of the auditor not later than the 5th day of the ensuing month pursuant to section 51 of the manual on the ngas for lgus, volume ii.",,not implemented reiterated in finding no. 3 of the report.,the consolidated report of accountability for accountable forms (craaf) and the individual raaf of collectors are not yet prepared.,"aar 2012 observ ation no.15, pages 39-40"
2228,,16. real property tax receivables and special education tax receivables were not set- up at the beginning of the year contrary to the,,not implemented. reiterated in finding no. 07 of the report.,real property tax receivables and special education tax receivables were not set-up at the beginning of cy 2013.,"aar 2012 observ ation no.16, pages"
2229,,"provisions of section 20 of the manual on the new government accounting system for local government units, volume i. we recommended that the municipal mayor should require the municipal treasurer to find ways and means on how to facilitate the preparation and submission of the duly certified list of taxpayers. the municipal treasurer should coordinate with the municipal assessor to come up with the required list.",,,,40-41
2230,,"1. the balance of cash in bank reflected the financial statements under general fund in the amount of p7,874,548.02 could not be ascertained and relied upon due to: a. erroneous and unrecorded disbursement, deposits and bank debit memos in the general ledger and cash book amounting to p1,881,402.48 p4,352,287.20, respectively, hence, books do not reconcile. b. non preparation of bank reconciliation statement, a violation of section 74 of pd 1445. we recommended that the municipal treasurer and the",,implemented implemented,reconciliation was made and adjustments were effected in the books reconciliation was made and adjustments were effected,
2406,," we strongly recommended that the municipal accountant and treasurer should prioritize the reconciliation of the gls and cashbooks of the cash in vault account since it involves cash. the accounting office and the municipal treasurer should always reconcile their records quarterly or monthly or as often to ensure that the reported balance is correct and accurate. the municipal treasurer as the fund custodian should initiate the reconciliation, if his schedule does not permit appoint trusted and competent personnel to participate in the reconciliation and even posting in the cashbooks. the local chief executive (lce) should compel the municipal accountant and treasurer to reconcile their records as the responsibility for the fair presentation and reliability of financial statements rests on them.",,no explanation from the management and reply to our management letter,,"part ii, observati on no. 2, page 20 to 22, cy 2012 arr"
2408,," we recommended that the municipal budget officer, accountant and the local finance committee should perform a thorough review and evaluation of the budget, whether annual or supplemental prior to its submission to the sangguniang bayan to ensure that all ps items are properly identified and classified as ps and that the appropriations for ps items shall not exceed the ps limitation at any point in time during budget year, in compliance with section 325(a) of ra 7160 and lbc no. 98 dated october 14, 2011.",,,,"part ii, observati on no. 4, page 24 to 26, cy 2012 aar"
2410,," we recommended that documents particularly the bac resolution recommending the resort to direct contracting method and explanation or justification for the deficiencies/violation discussed above be submitted to coa for evaluation. an inspection should likewise be conducted to determine that the price paid for the pumpboat acquired is reasonable and that the technical specifications of the pumpboat delivered is actually suitable for use in seaborne patrolling. for all the procurement activities henceforth, the municipality should undertake strictly in accordance with ra 9184.",,,,"part ii, observati on no.6,pag e 27 to 29, cy 2012 aar"
2491,,"1. receivables for real property tax under the general fund and special education fund were not set-up in the books which was not in conformity with the provision of section 20 of manual on the new government accounting system (mngas), vol. i, thus actual receivables from real property taxes during the year could not be determined. we recommended that management strictly adhere to the provision of section 19 and 20 of mngas in setting up the rpt/set receivables in accordance with the above-cited rules and regulations to reflect the actual collectibles from real property tax in the financial statements of the municipality.",,not implemented.,no assessment roll finished to municipal treasurer’s office which served as the basis in the computation or real property tax receivables due to editing of default installation of updated itax build 104 of real property owner. printing was suspended temporarily pending correction of software error. tentative printing submission of assessment roll will hopefully start first week of august 2013.,aar 2012
2493,,"3. petty cash fund vouchers were used for check payments of travelling expenses instead of disbursement vouchers, thus not in consonance with sections 32 and 33 of manual on the new government accounting system (mngas), vol. ii. we recommended that management strictly observe the use of disbursement voucher for payment of travelling expenses in order to ensure complete details of the financial transactions and in the recording thereof in the books of accounts.",,implemented.,"all disbursements in excess of one thousand pesos (php1,000.00) are paid thru checks. one thousand pesos (php1,000.00) & below are paid thru petty cash except for travelling expenses",aar 2012
2495,,5. some copies of approved contracts together with the supporting papers were not submitted to the office of the auditor as required in coa circular no. 2009-001 thus precluding the auditor from immediate review and evaluation thereof. we recommended that management comply strictly with the above-cited provision in the submission of copies of approved contracts including the supporting documents for review and evaluation.,,implemented.,we have subsequently submitted all approved contracts with the supporting papers to coa for review.,aar 2012
2496,,6. bank reconciliation statement (brs) was prepared for all funds instead of brs for each bank account maintained by the municipality; hence the difficulty in the review and verification of the cash in bank account. we recommended that the municipal accountant prepare bank reconciliation statement for each bank account and maintain subsidiary ledgers for each account in order to ensure that book balance for each fund reconcile with the bank balance of each deposit account.,,not implemented.,july 2013,aar 2012
2498,,"8. the municipality did not submit a report on the physical inventory of plant, property and equipment (ppe) with a total book value of p91,566,817.01 thus casting doubts as to the reliability of the accounts. we recommended that management expedite the preparation of the physical inventory and submit the same to the office of the auditor in compliance with section 122 of pd1445 and sections 65 and 66 of the mngas, vol. ii.",,not implemented.,"we have initially conducted physical inventory of property, plant & equipment in the latter part of may, as a result of the meeting among the different department heads & the municipal mayor in compliance with the order of the dilg, in relation to the turnover of the incumbent municipal officials to incoming elected officials. we hope to complete the inventory before year-end.",aar 2012
2500,,"10. the municipality was not able to collect real property taxes from taxpayers amounting to p18,205,788.16, thus depriving the agency of generating income which could had been used to finance development programs/projects for the benefit of its constituents. we reiterated the previous year’s recommendation that that the municipality exert more efforts to collect the delinquent realty taxes from taxpayers in order to increase collections which could be used in the implementation of development programs/projects beneficial to the constituents.",,not implemented.,,aar 2012
